{
  "schema_version": 1,
  "plugin": {
    "id": "kado-search",
    "version": "0.1.0",
    "display_name": "Kado Search",
    "description": "Find solutions to problems using current market options from Kado.",
    "short_description": "Find current solutions with the Kado CLI",
    "long_description": "Use Kado Search to describe a user's problem, outcome, context, and constraints, then find current market options across tools, agents, vendors, agencies, services, and architecture choices.",
    "developer_name": "Kado",
    "category": "Productivity",
    "capabilities": [
      "Interactive",
      "Read"
    ],
    "homepage": "https://kado.so/install",
    "website": "https://kado.so",
    "repository": "https://github.com/kado-so/search",
    "license": "MIT",
    "keywords": [
      "kado",
      "search",
      "solution-discovery",
      "recommendations",
      "vendors",
      "agents",
      "saas",
      "market-research"
    ],
    "brand_color": "#5B3DF5",
    "default_prompt": "Use $kado-search to find current solutions for our slow onboarding and early user drop-off."
  },
  "skill": {
    "path": "skills/kado-search",
    "description": "Find current external solutions to a user's problem with Kado. Use for recommendations, comparisons, shortlists, vendor or agency discovery, build-vs-buy choices, architecture options, migrations, procurement, and implicit pain points that benefit from current market options. Do not use for a local code edit, a stable factual answer, or when the user says not to search.",
    "compatibility": "Requires the installed kado CLI and network access to https://kado.so; install from https://kado.so/install.",
    "implicit_invocation": true,
    "icon_small": "assets/favicon.svg",
    "icon_large": "assets/icon-512.gen.png"
  },
  "marketplaces": {
    "codex": {
      "name": "kado",
      "display_name": "Kado",
      "source_path": "./",
      "installation": "AVAILABLE",
      "authentication": "ON_INSTALL"
    },
    "claude": {
      "name": "kado",
      "description": "Kado plugins for finding solutions to problems using current market options.",
      "source_path": "./"
    }
  },
  "installation": {
    "cli_executable": "kado",
    "cli_install_url": "https://kado.so/install",
    "source": {
      "kind": "github",
      "repository": "kado-so/search"
    }
  }
}
